id;time;username;follower_count;friend_count;user_verified;retweet_count;quote_count;like_count;reply_count;content
1462108900161998860;1637428901000;RenbaAdlarim;568;893;False;0;0;0;1;b'@robmolou Did you see Fernandes\xe2\x80\x99 gesturing at the fans saying it\xe2\x80\x99s not ole\xe2\x80\x99s fault? Bizarre.'
1462108862966812674;1637428892000;MikeLUHG0;24227;365;False;41;1;295;20;"b""Just to be clear.  If I see any of you gassing up Bruno Fernandes at all after that you'll be blocked.    \n\nI have no interest in fans that are so disrespectful towards the club that they support someone taking the piss out of the club this much. \n\nHope this helps"""
1462108858982223880;1637428891000;Eben_Ik;14803;10702;False;1;0;0;0;b'Okay, I blame the manager and you Bruno fernandes, happy now? https://t.co/6iR8BkjoYi'
1462108833439006720;1637428885000;tombrown_7;440;1249;False;0;0;0;0;b'Bruno Fernandes as well \xf0\x9f\x98\x82\xf0\x9f\x98\x82 weak. Piss poor player'
1462108764111310854;1637428868000;DavidKMutesaas1;1486;4300;False;0;0;0;0;b'@samuelluckhurst What role has Fernandes played today!'
1462108731303510020;1637428860000;FPLSteve;8635;990;False;1;0;34;6;"b'Common knowledge at this point \n\nMendy &gt; De Gea\nJames &gt; AWB\nSilva &gt; Verna \nR\xc3\xbcdiger &gt; Maguire \nChilwell &gt; Shaw \nJorginho &gt; Fred \nKante &gt; McTominay\nMount &gt; Fernandes\nHudson-Odoi &gt; Sancho \nWerner &gt; Rashford \nHavertz &gt; Ronaldo'"
1462108693705728003;1637428851000;Ndy__freke;1059;90;False;0;0;0;0;b'@MikeLUHG_18_0 Bruno Fernandes called the tactics that got us to lose 6:1, really?'
1462108683329019904;1637428849000;JerryDaponte;237;1262;False;0;0;0;0;b'Respect to Bruno Fernandes for trying to defend his manger. You never want blame to be placed on 1 man. End of the day it\xe2\x80\x99s in front of you who this falls on to. Mangers are always replaceable.'
1462108664869838853;1637428845000;KojoTip;3491;2768;False;0;0;1;0;b'Ronaldo and Fernandes post match interview \n#OleOut https://t.co/JuQciaA7rC'
1462108610599669763;1637428832000;telordadar40;64;363;False;0;0;0;0;b'@FabrizioRomano @footballdaily Ole tactics fails because of ronaldo, his tactics fit only if no ronaldo. CR7 make fernandes become mediocare player. I think MU no need CR7 in beginning'
1462108604966883328;1637428830000;aaIiyaan;529;805;False;0;0;2;2;b'just seen the pen we gave away and i can\xe2\x80\x99t begin to explain to you what a horrendous footballer fernandes is'
1462108520820748289;1637428810000;Staymadho3;301;213;False;0;0;0;1;b'I\xe2\x80\x99ve never seen a player disrespect the Manchester United fans more in my life than Bruno Fernandes has. https://t.co/qEOIRr0sI3'
1462108495298404363;1637428804000;GiveMeSport;62621;2476;True;0;0;5;1;b'Fernandes had to be pulled away by Fred as emotions ran high at full-time \xf0\x9f\x98\xb2\n\nhttps://t.co/rr8IOttAe0'
1462108405783486471;1637428783000;mps03;398;840;False;0;0;1;0;b'@irishjoegal Exactly, big mistake Ole coming to shake his hand on way off.\nFernandes my captain, (although had a shocker)'
1462108403795386371;1637428782000;DeanBruno123;511;2078;False;0;0;0;0;b'Ole Gunnar Solskjaer apologise to Man United fans. Bruno Fernandes sends a clear message to the whole team- like \xe2\x80\x98don\xe2\x80\x99t blame only the manager\xe2\x80\x99. \xf0\x9f\x94\xb4 #MUFC\n@FabrizioRomano https://t.co/3zXsikRhMa'
1462108388708560908;1637428779000;UtdGen;2137;2648;False;1;0;2;0;b'I watched Bruno Fernandes at CB, in the 2nd half and asked myself why can\xe2\x80\x99t captain Harry Maguire be this good.'
1462108344953491463;1637428768000;InterBoy1908;17437;1611;False;0;0;14;2;"b""Ole struggling with the Man United job, YES! But, Bruno Fernandes was right. #MUFC collectively failed to impress, NOT just Ole. Can't have Ronaldo, Fernandes, Rashford and lose 4-1. No disrespect to Ranieri's Watford. De Gea did his best. Should be his final wave to fans #OleOut"""
1462108302784016390;1637428758000;TheTwinsChanne1;36;177;False;8;2;32;1;"b'Emmanuel Dennis Two Celebrations\nCristiano Ronaldo &amp; Bruno Fernandes\nWatford vs Manchester United 4-1\n#MUFC https://t.co/0TMgoZ51Mn'"
1462108285348335622;1637428754000;mahsenmohammed1;308;269;False;0;0;2;0;b'Bruno Fernandes Defending Ole and pointing to all the players but Ole is ultimately the final piece https://t.co/oQwVF4Kl41'
1462108162815926282;1637428725000;goalmirror;2047;1165;False;0;0;0;0;b'(Video) Solskjaer apologises to Man Utd fans after Watford defeat, Fernandes argues with\xc2\xa0supporters https://t.co/hCJNdzj7uW'
1462108159540187144;1637428724000;Sportsinformer3;108;94;False;0;0;0;0;b'(Video) Solskjaer apologises to Man Utd fans after Watford defeat, Fernandes argues with\xc2\xa0supporters https://t.co/rBLNUwlkaN'
1462108111892844556;1637428713000;AndyWilmot1;514;268;False;0;0;0;0;b'Just waiting now for the obligatory 4 page apology from Rashford and Fernandes and then the standard \xe2\x80\x98we go again\xe2\x80\x99 Tweet from Maguire. \xf0\x9f\x99\x84'
1462108106964434949;1637428712000;HARISAN08421198;4;45;False;0;0;9;0;b'@UnitedStandMUFC Ole Gunnar Solskj\xc3\xa6r apologies to Man United fans. Bruno Fernandes sends a clear message to the whole team - like \xe2\x80\x98don\xe2\x80\x99t blame only there manager\xe2\x80\x99. \xf0\x9f\x94\xb4 #MUFC\n\n\xe2\xa4\xb5\xef\xb8\x8f\xf0\x9f\x8e\xa5 @footballdaily https://t.co/ERxJONPr42'
1462108081265983501;1637428705000;mps03;398;840;False;0;0;3;0;b'@AnnemarieDray Fernandes my captain (although had a shocker too)'
1462108014316511232;1637428689000;DabaaAbdi;222;217;False;0;0;0;2;b'Bruno Fernandes is a leader. Give him the armband. He is gesturing to blame the players instead of Ole. #oleinforever'
1462108010592063493;1637428689000;FutebolPitches;2;81;False;0;0;0;0;b'I think the problem at #MUFC is that to many players think that there position is guaranteed. I\xe2\x80\x99d like to see them sit Fernandes on the bench and start @Donny_beek6.'
1462107935996264454;1637428671000;MMVHlRD;226;379;False;1;0;4;1;b'I hate Bruno Fernandes so much like I\xe2\x80\x99ve never felt this way for a player ever. Maguire agenda on hold for now. https://t.co/VE9DCsN54k'
1462107896775417859;1637428661000;KwesiBenedict;38825;1390;False;4;0;56;1;b'Bruno Fernandes telling the fans not to  blame Ole only but the whole squad is a player who really loves his manager.'
1462107835467239432;1637428647000;SouthernBoiiy;1583;508;False;0;0;1;1;b'Which kind ITK Bruno Fernandes dey do \xf0\x9f\x98\x82\xf0\x9f\x98\x82\xf0\x9f\x98\x82'
1462107786498789382;1637428635000;PanasheBB;2772;2660;False;0;0;0;0;b'Bruno Fernandes on fraud watch\xf0\x9f\x94\xad'
1462107760665968642;1637428629000;ianwest1234567;109;852;False;0;0;0;0;b'Just love seeing Ronaldo and Fernandes crying'
1462107728248283137;1637428621000;ayoungleg;1184;838;False;0;0;0;0;b'@NickRagone_ @TheyKaulMeDanny Yeah how did your United Fernandes bet go?'
1462107723047264256;1637428620000;AnnemarieDray;46636;2801;False;584;41;6309;119;b'Bruno Fernandes gesturing towards the crowd that \xe2\x80\x98it\xe2\x80\x99s all of us\xe2\x80\x99 and not all on Ole Gunnar Solskjaer is absolutely immense of him. Huge respect for that \xf0\x9f\x91\x8f\xf0\x9f\x8f\xbc'
1462107647814029314;1637428602000;klazziqman;13;411;False;1;0;5;0;b'Solskj\xc3\xa6r apologies to the #mufc away end at full-time. Bruno Fernandes tells the fans not to boo him\n\nvia @footballdaily\n\nhttps://t.co/ci6LQFy6ZA'
1462107622245470213;1637428596000;OleLaden;244;419;False;2;0;3;0;"b""Fernandes might be a good player but he's a clown when it comes to backing Ole https://t.co/wH8ORRWZXH"""
1462107559863664644;1637428581000;Bergy10_afc;419;687;False;0;0;0;0;b'@SkySportsNews This clip is damning. Fernandes having to tell the fans to stop the abuse that they were obviously directing towards ole. I will use the hardcore away fans as a judge of the manager not these teens that @Iffy_aka_Giggs keeps battling.'
1462107507447324679;1637428569000;PrabhakaranSays;279;1816;False;0;0;1;0;b'@BecksPhilosophy Obviously Bruno Fernandes'
1462107498438176780;1637428566000;Munene__kariuki;12298;7901;False;0;0;0;0;b'Comeback Fc, De Gea penalties save masterclass, Osadebe steps up when needed most, Bruno Fernandes the midfield maestro,Roberto Shawcarlos and Maguire best \xf0\x9f\x98\x82\xf0\x9f\x98\x82\xf0\x9f\x98\x82\xf0\x9f\x98\x82'
1462107487247736834;1637428564000;Daylio1970;137;803;False;0;0;0;0;b'@talkSPORT Fernandes looked like he was having a go at the fans and was lead away'
1462107455794470914;1637428556000;capxcho;56;89;False;0;0;0;0;b'Who tf does Fernandes think he is?'
1462107426359021580;1637428549000;SunManUtd;56023;5;True;3;0;26;1;b'Bruno Fernandes argues with Man Utd fans and is PULLED AWAY by team-mate as Solskjaer is booed following Watford mauling https://t.co/3fuNs6X6vH'
1462107405106434053;1637428544000;Syl_fernandes;28;138;False;0;0;0;0;"b""Can't wait to see what Roy Keane has to say about Maguire \xf0\x9f\x98\x82\xf0\x9f\x98\x82\xf0\x9f\x98\x82 #oleonthewheel #ManchesterUnited_Watford"""
1462107401885302786;1637428543000;ManUtdDc;6;77;False;1;0;0;0;b'Bruno Fernandes Is A Disgrace To Manchester United Like how still support the manager after that in front of The United fans Is disgusting @B_Fernandes8 @Leven2k @Adamstott30 #brunofernandes #Portugal #manchesterunited #OleOut @markgoldbridge'
1462107400924803077;1637428543000;AOMU1878;377;96;False;0;0;0;0;b'@ManUtd Bruno Fernandes has asked the fans not to blame Solskjaer, but rather all the players. https://t.co/vB7tc08KCe'
1462107348948983810;1637428531000;leocallaghan17;371;700;False;0;0;6;1;"b'@SkySportsPL this is why billy gilmour &gt; bruno fernandes https://t.co/BtHJ762hJs'"
1462107347598417930;1637428530000;UnitedConduct;138;139;False;0;0;0;0;b'Solskj\xc3\xa6r apologies to the #mufc away end at full-time. Bruno Fernandes tells the fans not to boo him #UnitedConduct\n\nvia @footballdaily https://t.co/unER93xohL'
1462107287808577538;1637428516000;IamTopsy4real;1534;1419;False;0;0;0;1;b'Stupidity is Bruno Fernandes trying to defend the manager. \n\nBruno Fernandes is always full of himself anytime the team lose. The dude will come out talking as if he is the captain of the team. @B_Fernandes8 can you keep shut \xf0\x9f\x98\xa1 #WHTMUN'
1462107282213380102;1637428515000;Wadfordman;113;615;False;0;0;1;0;b'@DamonCochrane Fernandes too.'
1462107272662831109;1637428513000;MehtaAakash0713;42;321;False;1;1;0;0;"b""@ameeksha @kokomaster200 Bruno Fernandes in the behind telling fans tat it's not only manager, it the whole team performance \xf0\x9f\xa4\x94"""
1462107270318215178;1637428512000;Ilham_Farouqi;436;346;False;0;0;0;0;b'Respect Bruno Fernandes though. Definitely a better leader than other Utd players.'
1462107240777895948;1637428505000;JohnDoh40281930;777;1233;False;0;0;2;0;"b""@ThereseUTD Sorry Therese for your countryman getting the blame - that's football - but I honestly think whoever comes in will struggle because that team is much worse, as a whole, than it was last season. \nWhy? The heartbeat of the team is too-old Ronaldo when it should still be Fernandes."""
1462107220905189380;1637428500000;MikeLUHG0;24227;365;False;45;1;236;12;b'99% of this fanbase deserves the club to be in this state. \n\nYou let the manager get away with telling our fans the Glazers have invested loads of money and let Bruno Fernandes call tactics that lost 6-1 perfect.   You doormats caused this.  Enjoy it. \n\nHope this helps'
1462107215872073739;1637428499000;marlon7utd;34;161;False;0;0;0;0;b'@GNev2 You still backing your mate @GNev2 ? Stop mucking about! Yes the team is crap, the apparent captain needs to be given the boot, Fernandes needs to be benched or given a break, but surely this is the end of the road for Ol\xc3\xa9!'
1462107205789011973;1637428497000;PaddysMad;4390;4782;False;0;0;0;0;b'@paddypower It\xe2\x80\x99s all Bruno Fernandes fault aswell.'
1462107196666400774;1637428494000;shrimpdon_;2437;1248;False;0;0;10;1;b'bruno fernandes plays football like he needs the game to finish quickly so he can take a shit'
1462107187816407041;1637428492000;MUFCemptyseats;3461;1679;False;2;0;2;0;b'Fernandes blames the Glazers for the defeat! \xf0\x9f\xa4\xa3\xf0\x9f\x98\x84 #worstfansinfootball #mufc #MUFC_FAMILY https://t.co/NGPwsKDR0U'
1462107149371334661;1637428483000;kiani93;245;1893;False;0;0;1;0;b'As soon as the new boss is in he needs to take the armband off Maguire and hand it to Fernandes, the Brexit thinking is ruining us time and again https://t.co/D8ilvBtRdz'
1462107124620738567;1637428477000;_mubiin;1069;1066;False;0;0;2;0;b'Banter aside. Bruno is a real one #Fernandes #ManUtd https://t.co/YRolMuMUmm'
1462107099467550733;1637428471000;Veencent_;1556;1821;False;0;0;0;0;"b'Fernandes talks too much. \n\n""Don\'t blame the manager"" \n\nOde'"
1462107088767885322;1637428469000;zeleLUHG;1799;924;False;1;0;8;2;b'hate bruno fernandes so much man.'
1462107077619372041;1637428466000;haroldlgarroz;958;1331;False;0;0;1;1;"b""Fernandes seemed to have his head on Serbia. I can't believe Ole let him all game. #MUFC"""
1462107055490281479;1637428461000;LondonK25822065;66;2455;False;0;0;0;1;b'Here are my player ratings for Man Utd\nde Gea 3/10\nWan-Bissaka 2/10\nLindel\xc3\xb6f 2/10\nMaguire 1/10\nShaw 2/10\nMcTominay 2/10\nMatic 2/10\nSancho 3/10\nBruno Fernandes 2/10\nRashford 3/10\nCristiano Ronaldo 3/10\nMartial 2/10\nLingard 3/10\nDiogo Dalot 2/10\nvan de Beek 3/10'
1462107037630935040;1637428457000;dareylyon;2129;1452;False;0;0;0;0;b'Waiting for Rashford and Fernandes to draft something for us as usual. \n\nAnticipating \xf0\x9f\x99\x83\xf0\x9f\x99\x83'
1462107020463468553;1637428452000;_devilnoob_;1167;1135;False;0;0;1;0;b'@utdeyetest Man like really Fernandes is so shit when it comes to progression in the mid'
1462107008564355073;1637428450000;RugbyJoel;28;135;False;0;0;0;0;"b""Bruno Fernandes was spot on to call out the United booboys. A bunch of fans still living in the shadow of past glories. The days of one team domination are gone.. and they aren't coming back. United fans need to accept their new place in the game #mufc"""
1462106999559229444;1637428447000;ntswe;417;89;False;0;0;0;0;b'Man. U must get a new Manager. That manager must have the courage to as for more from Fernandes and Ronaldo. Their efforts without the ball is not acceptable for where football is currently.'
1462106971071565827;1637428441000;funnymanmike;403;278;False;0;0;1;0;b'Fernandes will be the next managers problem.\n\nFact is VDB is better. \nSimple https://t.co/WjOaz69IYl'
1462106866415284228;1637428416000;BurnitonSkido;1673;1631;False;1;0;4;0;b'Waiting for Bruno Fernandes apology \xf0\x9f\xa4\xa3\xf0\x9f\xa4\xa3\xf0\x9f\xa4\xa3'
1462106859507179530;1637428414000;IsmailPaxked;351;405;False;0;0;1;0;b'Bruno Fernandes aint scored in 12 matches \xf0\x9f\x91\x81'
1462106836400750598;1637428409000;_ShauniH;1425;1185;False;0;0;0;0;b'Fair play to fernandes \xf0\x9f\x91\x8f\xf0\x9f\x8f\xbc https://t.co/RhEJi4ZZFl'
1462106757484871681;1637428390000;Calvienleee;69;135;False;0;0;1;0;b'\xf0\x9f\x97\x9e Solskj\xc3\xa6r holds his hands up to apologise to the away fans at full time, and receives quite a few boos. Bruno Fernandes argues back to the away end and is pulled away by Fred. [@TyMarshall_MEN]'
1462106709162348550;1637428378000;mufc4thefans;3302;1184;False;1;0;6;0;b'Side note Bruno Fernandes has been dreadful for months'
1462106667269640200;1637428368000;afcbrxd;392;266;False;0;0;3;0;b'Are people gonna start talking about how poor Bruno Fernandes has been? No one stops talking about him when he plays well \xf0\x9f\xa4\xa5'
1462106661812936708;1637428367000;MQUTins;2325;642;False;0;0;5;0;b'bruno fernandes is right that the players are shit, but also wrong in that the manager is also shit'
1462106658398781446;1637428366000;ttid4ever;921;1507;False;0;0;0;0;b'@MiguelDelaney If Fernandes wants to win anything he must leave Man United. That is how it works!! \xf0\x9f\x98\x84\xf0\x9f\x98\x84\xf0\x9f\x98\x84\xf0\x9f\x98\x84'
1462106629516709892;1637428359000;UTDNel;6;0;False;0;0;0;0;b'Bruno Fernandes should be dropped as well. He has been ordinary since the penalties dried up https://t.co/ZwsaIWEdOd'
1462106602635288576;1637428353000;EvinPaulDaniel;608;3026;False;1;0;54;2;b'@footballdaily Bruno Fernandes shows real character. Some players went into hiding today. They should be criticized too'
1462106517562347530;1637428333000;charlie030293;257;305;False;0;0;0;0;b'1. I find it odd when teams win a game and they\xe2\x80\x99re fans start chanting about oles daft wheel rather than celebrating and 2. That\xe2\x80\x99s class from fernandes #mufc #watfordfc https://t.co/qSXWJxE746'
1462106481621450756;1637428324000;Badman_papi;3659;2219;False;0;0;0;0;"b'Nobody:\n\nMarcus Rashford &amp; Bruno Fernandes: https://t.co/pTdmW2AhYI'"
1462106481151512579;1637428324000;FPLShoyo;29;524;False;0;0;1;0;b'This is why fernandes should be captain and not Maguire, accepting respond rather than the cupping the ears celebration and a red card. https://t.co/dfPuRghqDz'
1462106462600245250;1637428319000;jr131074;29;225;False;0;0;0;0;b'@samuelluckhurst I my eyes Fernandes is part of the problem always sulking'
1462106449119784974;1637428316000;AhmedMonde10;0;21;False;0;0;1;0;b'@fpl_M_girl Untill Ronaldo arrived Fernandes out off his form I think so'
1462106333725937669;1637428289000;zezextra;762;1475;False;1;0;5;0;b'No way Ronaldo, Rashford and Bruno Fernandes invest more time on apology essay than training for football.'
1462106205057429504;1637428258000;kenga_brian;2755;2888;False;0;1;3;3;"b""Truth be told Ronaldo is a total baggage. He's inept defensively. He loses the ball easily. This will eventually prove to be a bad signing. Look at Fernandes nowadays ? He's had assists here and there but his performances have been very poor ! Coz he's forced to to do extra ..."""
1462106204709265412;1637428258000;Zen20h;415;441;False;0;0;0;0;"b""I'm not Manchester United fan but I feel it's high time Ole left.\n#OleOut The squad have world class players in Ronaldo, Bruno Fernandes, Pogba, Rashford, De Gea, Varane, Cavani, etc. They really shouldn't be losing 1:4 to Watford.\nZindane or Erik Ten Hag or Brendan Rogers in."""
1462106190364561408;1637428255000;rajiv3394;115;362;False;0;0;0;0;b'@FabrizioRomano @footballdaily Fernandes...its okay that Ole got you here. Thats okay. He should leave and do not blame yourself for such a bad team setup and  coaching.'
1462106113952915459;1637428236000;SoccerStash;432;443;False;0;0;0;0;b'@FabrizioRomano @footballdaily Fernandes was one of the worst players on the pitch today.'
1462106103139946497;1637428234000;fredwnelson;800;682;False;0;0;0;1;b'@gillybee66 @NormanR01779631 @neal_army Lol. He would drop Fernandes. I guess Haary Maguire will be banned so they will be better at the back at The Bridge \xf0\x9f\xa4\xa3'
1462106091622477831;1637428231000;John_Red007;186;138;False;0;0;0;0;b'Maguire, Shaw and Fernandes horribly off-form for weeks now but untouchable on reputation. Sancho looked a lot better with VDB playing in and around him.'
1462106081165991937;1637428229000;SithLurd;277;266;False;0;0;0;0;b'Bruno Fernandes needs to keep quiet and let this clueless man go.'
1462106076099325952;1637428227000;Swerve_Ben;31;64;False;0;0;0;0;b'Bruno fernandes is overhyped and overrated his purple patch is over'
1462106056436240387;1637428223000;AryanKokane;91;175;False;0;0;0;0;b'Fraud fernandes can fuck off as well! Always shouting at players and putting his hands up as if he is the boss https://t.co/LylYn2gh6c'
1462106016615735300;1637428213000;gregofallgregs;527;894;False;0;0;0;0;b'Fair play to Fernandes. They were shocking and that was the choice of the players https://t.co/twDM92WZJG'
1462105990778822656;1637428207000;TheUnitedDevils;16203;15696;False;8;0;65;1;b'Bruno Fernandes was arguing with some fans in the away end but was brought away by Mata. Solskjaer consoled him. Solskjaer held his hands up apologetically as he accepted the boos. \n#MUFC [@samuelluckhurst]'
1462105973758341122;1637428203000;ryan_2611;414;868;False;0;0;1;0;b'We do not deserve Fernandes https://t.co/445AV42mp3'
1462105956834177026;1637428199000;HigherPrimate7;102;454;False;0;0;0;0;b'@samuelluckhurst more performative bullshit from Fernandes.'
1462105927696408586;1637428192000;Sterling_777;251;245;False;12;0;118;2;"b""Can't believe Sarr scored and begging Manchester United not to sack Ole \xf0\x9f\x98\xad\n\nMaguire | Fernandes | Maguire | Sancho | De Gea https://t.co/FcUEcW841x"""
1462105913079345152;1637428188000;PitoSeller;9919;8437;False;3;0;8;1;b'By now Bruno Fernandes draft en thesis full of apologies. Ei e no easy oh \xf0\x9f\x98\x82\xf0\x9f\x98\x82\xf0\x9f\x98\x82\xf0\x9f\x98\x82\xf0\x9f\x98\x82\xf0\x9f\x98\x82\xf0\x9f\x98\x82'
1462105882410598400;1637428181000;klazziqman;13;411;False;0;0;0;0;"b""Fernandes is speaking to one of the broadcasters. Seemed like he was suggesting the fans shouldn't boo Solskjaer but blame the players. #mufc"""
1462105869441814528;1637428178000;mattblake94;306;738;False;0;0;0;1;b'I have bucketloads of love for Bruno Fernandes, but how in the FUCK is he shaking his head when the fans boo after we just lost 4-1, and previously 7-0 collectively to both of our rivals. \n\nDo NOT get ahead of your station Bruno. We have a right. SMH. \n #WATMUN'
1462105865788350468;1637428177000;oleglazersedout;59;76;False;0;0;0;0;b'yeap, bruno fernandes, you can fuck off with ole if you back ole still after this'
1462105860042379264;1637428176000;Mallon7Niall;193;508;False;0;0;0;0;b'Bruno Fernandes loves The Arsenal and wants him to stayyyy https://t.co/rGBtGAcc58'
1462105851561275392;1637428174000;utdfz_;30;126;False;0;0;0;0;"b'Just shut up man. Fernandes I respect you balling &amp; your passion, but just learn to keep quiet at times https://t.co/RpbDlTiWmC'"
1462105814068383745;1637428165000;jejaka_prihatin;206;251;False;0;0;0;0;b'Class from Bruno Fernandes, the real captain~ \xf0\x9f\x91\x8f https://t.co/CGlWkuk9RT'
1462105709668151302;1637428140000;patrickuyoro;953;914;False;0;0;0;0;b'@cirocdboy Lmfao u know Fernandes handler mistakenly tweeted Martinelli with \xe2\x80\x9cgood vibes\xe2\x80\x9d caption last time. People know his own is bullshit now so i don\xe2\x80\x99t think he\xe2\x80\x99ll even bother \xf0\x9f\xa4\xa3'
1462105666026307591;1637428130000;sl_manutd;120;112;False;2;0;3;0;b'Solskjaer went with team to applaud away fans + a significant number returned V signs + booed. Fernandes remonstrated, telling supporters to take anger out on everyone. Was ushered away by Fred. A sad picture of a broken situation. [@samuelluckhurst]\n#MUFC #OleOut'
1462105631914086417;1637428121000;TheRealFbloke;6372;1711;False;0;0;1;1;b'@DepasoisMike Genuinely surprised by the way things have developed. The senior pros have let him down IMHO and the top of my list is Fernandes whose attitude stinks'
1462105625698131984;1637428120000;lifeofaDrugthug;509;1910;False;0;0;0;0;"b""Man united don't deserve, rashford, Fernandes, Martial, greenwood, lingard, Sancho, cavani and Ronaldo..they are wasting this guy's potentials, they should find other club since Ole don't want to be out  #WOLWHU"""
1462105592840007681;1637428112000;JohnDoh40281930;777;1233;False;0;0;0;0;"b""@UtdRocco 1) Sack OGS\n2) Make Ronaldo Manager\n3) Make Fernandes the fulcrum of the team again.\n\nIf that doesn't work, sack Ronaldo! \n\nBecause you can change the manager but the whole team will still struggle under the weight of his ego and lack of defensive effort."""
1462105589161635848;1637428111000;Ronizio2660;189;164;False;1;1;0;1;b'ronaldo put in a spliff, Bruno Fernandes put in a spliff, jado Sancho put in a spliff, Marcus Rashford put in a spliff \xf0\x9f\x9a\xac\xf0\x9f\x9a\xac\xf0\x9f\x9a\xac'
1462105574108184578;1637428108000;NabeelC_;113;106;False;0;0;1;1;b'@mani_masteriza How to improve my beloved Manchester United in 5 easy steps:\n\n1. Sell Pogba \xf0\x9f\xa4\x91\n2. Sell Bruno Fernandes \xf0\x9f\xa4\x91\n3. Sell Sancho \xf0\x9f\xa4\x91\n4. Sell Rashford \xf0\x9f\xa4\x91\n5. Make Fred and Ole extend their deals \xf0\x9f\x93\x9d\n\nThese came down deep from my heart don\xe2\x80\x99t let me down again, please !!!!'
1462105571268644870;1637428107000;Com4fiz;158;226;False;0;0;0;0;b'They should have booed Fernandes\xe2\x80\x99 weird ass too'
1462105568072683522;1637428106000;Veencent_;1556;1821;False;0;0;0;1;b'Walahi Fernandes desire to win is just on his lips. Na wa. https://t.co/AcjkwARpkc'
1462105555275857925;1637428103000;samuelluckhurst;306647;1848;True;332;197;4317;252;"b""Fernandes is speaking to one of the broadcasters. Seemed like he was suggesting the fans shouldn't boo Solskjaer but blame the players. #mufc"""
1462105546669146113;1637428101000;YrFavBurner;36;106;False;0;0;1;0;"b""We don't  only blame the manager, we also blame his pathetic favourites. Maguire, Shaw, Wan Bissaka, Mcfred, Fernandes. https://t.co/Zpsed4PsEn"""
1462105531049467911;1637428097000;klazziqman;13;411;False;0;0;0;0;b'\xf0\x9f\x97\x9e Solskj\xc3\xa6r holds his hands up to apologise to the away fans at full time, and receives quite a few boos. Bruno Fernandes argues back to the away end and is pulled away by Fred. [@TyMarshall_MEN]'
1462105515014688769;1637428094000;kxngwallace;1072;643;False;0;0;0;0;b'Get a new coach, give Fernandes the arm band, and that\xe2\x80\x99s a start.'
1462105504084381704;1637428091000;footy_prime;2787;4935;False;0;0;6;0;b'Ole Gunnar Solskj\xc3\xa6r apologizing to the travelling #ManUtd fans. Notice Bruno Fernandes\xe2\x80\x99 \xe2\x80\x9cblame all of us, not just him!\xe2\x80\x9d reaction #WATMUN \n\nhttps://t.co/lTJyd0QtpM'
1462105493481082888;1637428088000;liamkenwright91;436;223;False;0;0;1;0;b'New manager in. Play VDB and Sancho, take the armband off Maguire so he can concentrate on his football and put a fucking rocket up Bruno Fernandes\xe2\x80\x99s arse. Roll on Spain \xf0\x9f\xa5\xb3'
