id;time;username;follower_count;friend_count;user_verified;retweet_count;quote_count;like_count;reply_count;content
1453458569584599048;1635366501000;saadfootballl;611;530;False;0;0;0;1;"b'Man City starters, Walker, Palmer, Mahrez &amp; KDB and brought on Cancelo, Jesus, Foden &amp; Grealish. Bro we cannot compete with this.'"
1453458543332503565;1635366495000;SteJamBot;35;163;False;0;0;2;0;"b""@City_Xtra We've subbed off a xouple of our regular penalty takers (Mahrez, DeBruyne) which is interesting. Last sub Ederson outfield to take one?"""
1453458358934118404;1635366451000;desmondaddai_;2123;567;False;0;0;0;0;b'@MoSakoooo @City_Xtra @ManCity Mahrez has been shit of late'
1453458354177601536;1635366450000;diaskadais;851;807;False;0;0;0;0;b'btw we took off kdb and mahrez, our first two pk takers'
1453458340126859267;1635366446000;ethanncfc;642;413;False;0;0;0;1;b'@SDobrevv2 @Sxne19iv2 only Mahrez pen I can remember is the one at Anfield'
1453458331750785026;1635366444000;Grealish_Szn1;12;27;False;0;0;3;1;b'@City_Xtra If it does go to pens who would take them. We literally have no kdb or mahrez. Our best ones. And sterling and Jesus who are terrible at pens on.'
1453458029110775812;1635366372000;buzza1987;417;830;False;0;0;1;0;b'Not convinced it will get there but in Mahrez, we have taken off our penalty taker \xf0\x9f\x98\xb3. #Mancity #mcfc #CarabaoCup #WHUMCI'
1453458016758534154;1635366369000;Hamza2go;34;164;False;0;0;0;0;b'How many algerian flags are in the london stadium #WHUMCI @Benrahma2 @Mahrez22'
1453457956406763531;1635366355000;FussballHJ;4243;527;False;0;0;8;2;b'The way I see our offensive players rn is there\xe2\x80\x99s the hungover ones (always make wrong decisions or have bad execution in final 1/3): KDB, Mahrez, Sterling, even JG\n\nAnd the lively and productive ones: Bernardo, Foden, GJ'
1453457926396551170;1635366348000;adamtheskyblue;97;423;False;0;0;1;0;b'If this goes to penalties, we took Mahrez off \xf0\x9f\xa4\xa6\xe2\x80\x8d\xe2\x99\x82\xef\xb8\x8f'
1453457442033913858;1635366232000;jacob56648;15;99;False;0;0;0;0;b'@mcfcleo2 @ManCity De bruyn dragging uselessness with sterling and mahrez, since club brugge he has been shit'
1453457340875870217;1635366208000;emmaosas17;276;683;False;0;0;1;0;b'@UtdRajj Bro I rate mahrez but by that app\xe2\x80\x99s logic he\xe2\x80\x99s been the best player on the pitch and that\xe2\x80\x99s just not true that\xe2\x80\x99s why he\xe2\x80\x99s off'
1453457136818827272;1635366160000;Ethan4707;191;122;False;0;0;0;0;b'I was right again, Sterling and Mahrez in the same team means a poor performance'
1453457026735030273;1635366133000;mbaalthani8;134;1662;False;0;0;4;1;b'@umirf1 Many players haven\xe2\x80\x99t been good. Dinho, de Bruyne, mahrez'
1453457017176219651;1635366131000;cityBen_;757;1642;False;0;0;1;0;b'@mrahsannaeem It\xe2\x80\x99s like when we heavily rotate and are off the pace. But this time we\xe2\x80\x99ve managed it with Kev, Sterling and Mahrez.'
1453456924972929025;1635366109000;AyyanBaan;1668;1317;False;0;0;0;0;b'@UtdRajj @CityzioM all them players have been bad for ages, except mahrez and there\xe2\x80\x99s been a lot of de bruyne slander tonight aswell'
1453456914453512193;1635366106000;Zakyyyyyyyyyyy7;57;234;False;0;0;0;1;b'Mahrez off and Cancelo RB? yea turn the TV off'
1453456573523808257;1635366025000;UtdRajj;1237;498;False;0;0;0;3;b'@CityzioM Keep seeing people say Mahrez is terrible. You all also hate Sterling ak\xc3\xa9 mendy etc. But when a white player puts a foot wrong there\xe2\x80\x99s never a mention of it #troofstings'
1453456556985552896;1635366021000;michael76388280;478;1450;False;0;0;1;1;b'@DdaIssa Yep foden on for Mahrez unfortunately'
1453456514404995081;1635366011000;prideofeastldn;3036;3793;False;0;0;1;1;b'So many Algeria flags tonight. They came for Benrahma vs Mahrez.'
1453456445274533896;1635365995000;CanceloProp;535;451;False;0;0;0;0;b'If this goes to pens we have no mahrez. Should\xe2\x80\x99ve taken Palmer off'
1453456157268393986;1635365926000;cityBen_;757;1642;False;0;0;1;1;b'@dankthemanc Been very poor. But I\xe2\x80\x99d say the same for Kev and Mahrez too. All look way off it'
1453456155733336066;1635365926000;woramangra;9728;3394;False;0;0;1;1;b'Oh my God, Sterling will make me break something at home out of anger. What kind of annoying play is this? Pep should be hooking him n not Mahrez.'
1453456120144609282;1635365917000;Elpeakys;27;489;False;0;0;0;1;b'@SebWassell Yess, 1 FT to transfer out Mahrez for one of Foden or Son. (Gotta make 3 transfers to get them both in the same GW which is out of the question)\nI\xe2\x80\x99m planning to have them both by GW12 (especially Son) but struggling to chose one to get now for GW10 and GW11.'
1453456114553663495;1635365916000;Ikzera01588590;267;378;False;0;0;0;0;b'#Atal (#OGCNice) is playing very well against #OMarseille.\n#Bensebaini (#borussiam\xc3\xb6nchengladbach ) scored 2 goals against #BayernMunich .\n#Paradourules\n#Algeria\n#Fennecs\n#DZfoot\n#mahrez https://t.co/b1tVUyvME0'
1453456075198451727;1635365906000;ManCityFra;145272;232;True;3;2;34;9;"b""72' Changement \xf0\x9f\x94\x84\n\n@PhilFoden remplace @Mahrez22 \xf0\x9f\xa4\x9d\n\n\xe2\x9a\x92\xef\xb8\x8f 0-0 \xf0\x9f\x94\xb5 https://t.co/2BpRYktWRL"""
1453456017535217666;1635365893000;ManCityAlways;334;379;False;0;0;4;3;b'Why Mahrez off Pep has an agenda I swear'
1453455857899999233;1635365855000;CitizenMalone;16;58;False;0;0;0;0;b'How the fuck is Sterling stating on and mahrez going off'
1453455849125556235;1635365852000;LiamMcfc16;500;813;False;0;0;1;1;b'How Mahrez continues to get a game is astonishing'
1453455740287557642;1635365827000;Fodenszns;2195;1043;False;0;0;0;0;b'Not sure about taking Mahrez off ngl definitely when it seems like we might be heading to pens'
1453455740262391810;1635365827000;JackMCI_;194;986;False;0;0;1;0;b'Why bring mahrez off when he is are best penalty taker?\xf0\x9f\xa4\x94'
1453455722633695239;1635365822000;Ethan4707;191;122;False;0;0;0;0;b'Mahrez off, TV off\n\nLooks like Raz on the right which is good'
1453455721027280896;1635365822000;imadv8;44;261;False;0;0;2;1;b'mahrez off tv off'
1453455718229684229;1635365821000;leoNinous;1;11;False;0;0;8;1;b'@ManCity pep tactics so weak , he always take off mahrez , lol so predictible'
1453455716069658632;1635365821000;KC_UOD;354;717;False;0;0;0;1;"b""72' | \xe2\x9a\x92\xef\xb8\x8f 0-0 \xf0\x9f\x94\xb5\n\nNow City go to the bench for the 2nd time tonight, with Riyad Mahrez OFF, Phil Foden ON.\n\n#COYI #WHUMCI"""
1453455714995822601;1635365821000;HxH_Ura;12;43;False;0;0;2;0;"b""@ManCity Mahrez os the best city player here. It's Stelring who shoulb be out"""
1453455667205971968;1635365809000;blul0tus;341;957;False;0;0;0;0;"b""@ManCity @HaysTechnology Mahrez off for Foden at 71'"""
1453455640689577988;1635365803000;ManCityzenscom;69863;60790;False;2;1;87;20;"b""Riyad Mahrez's performances this season. Discuss \xf0\x9f\x91\x87 https://t.co/rnGJrbGDqS"""
1453455586423619589;1635365790000;Joshten7;221;542;False;0;0;0;0;"b""That might be the first ever time Mahrez has been hooked when he's being fucking awful."""
1453455574948061184;1635365787000;KOBBYANY;49;75;False;0;0;0;0;b'@Ynezr19 @City_Xtra @ManCity Yeah Mahrez is off! Wasteful all game too.'
1453455558791548932;1635365783000;ManCity;11274601;50891;True;33;14;943;35;b'CITY SUB | Mahrez makes way for Foden \xf0\x9f\x94\x84\n\n\xe2\x9a\x92\xef\xb8\x8f 0-0 \xf0\x9f\x94\xb5 https://t.co/wJ017JTQgw'
1453455453631942657;1635365758000;City__Brad;928;960;False;0;0;0;0;b'Mahrez really not been good enough recently it\xe2\x80\x99s a shame hopefully he gets back to his old form'
1453455450909941769;1635365758000;owenmcc0lgan;408;954;False;0;0;1;0;b'Mahrez off, Foden on, thank god'
1453455433096744964;1635365753000;Dawood_Saidi;81;173;False;0;0;0;0;b'@PhilFoden in for @Mahrez22\n#EFLCup #MCFC #CmonCity'
1453455419549143044;1635365750000;WestHamNow_;4296;1012;False;0;0;0;1;b'71\xe2\x80\x99 | Substitution for Man City: #WHUMCI #COYI\n\n\xe2\x9e\xa1\xef\xb8\x8f Phil Foden\n\xe2\xac\x85\xef\xb8\x8f Riyad Mahrez\n\n#WHUFC 0-0 #ManCity'
1453455381154484228;1635365741000;Vhero;378;933;False;0;0;1;0;b'Mahrez for Foden should have happened MUCH earlier. Mahrez has had a mare today.'
1453455244931837964;1635365708000;gunsbugsnpower;1546;2969;False;0;0;0;0;b'Mahrez finally off. Should have gone off at half time'
1453455242037694467;1635365708000;LuquiSotelo;67;782;False;0;0;0;0;b'Phil Foden a la cancha por Riyad Mahrez.'
1453455226988634125;1635365704000;iamhassan_91;10996;6136;False;0;0;1;0;b'Mahrez off Foden in let\xe2\x80\x99s go golden boy'
1453455214183428099;1635365701000;_the1894;1232;980;False;0;0;2;0;b'Phil Foden replaces Riyad Mahrez. \n\n#WHUMCI https://t.co/4LGSO3BQHl'
1453455210320367628;1635365700000;lancebrown19;1360;915;False;0;0;0;0;b'Mahrez don\xe2\x80\x99t play Ntn'
1453455178762493955;1635365693000;FussballHJ;4243;527;False;0;0;1;1;b'@EklavyaChawla16 Genuinely forgot Mahrez was on the pitch. Mahrez for Grealish Foden for Palmer'
1453455099343298566;1635365674000;HeadieOne17;203;728;False;0;0;0;0;b'@mxnciteh He\xe2\x80\x99s on for Mahrez'
1453455010755448842;1635365653000;City_Xtra;263054;946;True;12;10;514;27;"b""[71'] Sub: Phil Foden replaces Riyad Mahrez. 0-0."""
1453454997136494592;1635365649000;crucialcancelo;1449;735;False;0;0;2;0;b'FINALLY MAHREZ OFF'
1453454962680340483;1635365641000;WayOfAce;1177;1095;False;0;0;0;0;b'Mahrez kick some cunt today fr'
1453454954065244165;1635365639000;City_Chief;183714;728;False;3;1;73;0;b'70\xe2\x80\x99 | Phil Foden is coming on for Riyad Mahrez.\n\n#ManCity | #WHUMCI | #MCFC'
1453454843801128974;1635365613000;SamLee;145242;1696;True;7;8;194;5;b'Foden coming on for Mahrez'
1453454795226767363;1635365601000;rahulmcfc;2067;649;False;1;0;14;0;"b""The combinations are probably the worst right now at City. Mahrez-Sterling wingers, Cancelo, KDB, Mahrez trio on the right side, Gundo-Sterling. Doesn't help that KDB is badly out of touch, half the players aren't fit enough and West Ham are incredibly drilled."""
1453454683008348168;1635365574000;EklavyaChawla16;274;493;False;0;0;0;1;b'@FussballHJ Raheem and Palmer are our main threats it needs to be Mahrez and Gundo/Kev off'
1453454600615387142;1635365555000;_ShauniH;1425;1185;False;0;0;1;0;b'Jesus, Foden and Grealish on. Get Mahrez, Sterling and KDB off.'
1453454454305476616;1635365520000;awakeupmrwest;1235;298;False;0;0;1;0;b'I\xe2\x80\x99ve come back so humbled\xe2\x80\xa6Mfs complain about Mahrez 24/7\xe2\x80\xa6 try watching John Anthony Brooks every week \xf0\x9f\x98\xad'
1453454300647145473;1635365483000;YanisDz26;353;583;False;0;0;0;1;b'Where is Mahrez bro ? https://t.co/rSSnop2YLh'
1453454291289653257;1635365481000;_TJ932O;636;119;False;0;0;1;0;b'@Priceless_Silv_ He\xe2\x80\x99s in the same limbo that sterling or Mahrez are in atm but because he\xe2\x80\x99s covered it up with some G/A no one really cares'
1453453875416010757;1635365382000;owenmcc0lgan;408;954;False;0;0;0;0;b'@turnerdilf Mahrez is dogshite, i\xe2\x80\x99d create more of a goal threat than him'
1453453280319791118;1635365240000;citehkacper;860;986;False;0;0;0;0;b'@rxlfpacked Mahrez has been ass'
1453453266793254917;1635365237000;Grealish_Szn1;12;27;False;0;0;0;0;b'@xyzb112c @City_Xtra If it stays level game goes to pens. Need mahrez and kdb on lol.'
1453452819953029132;1635365130000;xyzb112c;225;261;False;0;0;2;2;b'@City_Xtra Hopefully we\xe2\x80\x99ll soon see Mahrez, de Bruyne and Sterling coming off'
1453452799459659777;1635365125000;mcfcOrtega;555;969;False;0;0;0;0;b'Bring Mahrez off and bring on Foden'
1453452763199848450;1635365117000;owenmcc0lgan;408;954;False;0;0;0;0;b'Just get Mahrez off'
1453452720707362817;1635365107000;Maverick177uk;332;722;False;0;0;0;0;b'Hook Mahrez and KDB for Grealish and Foden'
1453452579422277642;1635365073000;rxlfpacked;1161;493;False;2;0;29;1;b'This Mahrez Palmer Sterling performance https://t.co/CnEF05TyDT'
1453452529413632008;1635365061000;sirbartman;707;550;False;0;0;1;0;b'Mahrez stinker too'
1453452431011024900;1635365038000;owenmcc0lgan;408;954;False;0;0;1;1;b'Seen enough, Foden and Grealish on for Mahrez and Palmer'
1453452386484301831;1635365027000;AsandeMlotshwa;592;459;False;0;0;0;0;b'Mahrez is so useless. \xf0\x9f\x98\x94'
1453452325918580745;1635365012000;DavidHartley21;1103;470;False;0;0;1;3;b'Any danger of us sticking one of these chances in? We\xe2\x80\x99re living dangerously here. West Ham are carving through us like butter when they do get the ball. Mahrez and Sterling are just holding things up and running into traffic. Can we not play them on the opposite sides.'
1453452207173644293;1635364984000;SFC_BOSS;1117;684;False;0;0;0;0;"b""Take off mahrez he's not helping at all, since the sub of walker cancelo has being left alone and that's where West Ham are attacking from in the 2nd half"""
1453451744269250564;1635364874000;trustinpep;223;684;False;0;0;0;0;b'Mahrez has been embarrassing tonight \xf0\x9f\x98\xa1'
1453451622567264259;1635364845000;abooker17;1011;798;False;0;0;2;0;b'In an attack of Sterling, KDB, Mahrez, Palmer, and Gundogan...Cole Palmer has the been the best attacker, incredible for just another local kid.'
1453451581664288774;1635364835000;AarxnMCFC;5538;555;False;0;0;38;0;b'Foden/Grealish on for Mahrez, move Sterling to the right'
1453451570755080196;1635364832000;McfcRobbo23;128;272;False;0;0;1;0;b'whenever sterling and mahrez play together the team feels so slow'
1453451449699115012;1635364804000;espeezeal;11652;10998;False;0;0;0;0;b'Are we seriously going to start calling for sterling and mahrez to be subbed off before we can win a league cup game ffs!'
1453451447169847307;1635364803000;crucialcancelo;1449;735;False;0;0;1;0;b'Get mahrez off Grealish on sterling on the right'
1453451333441363973;1635364776000;umirf1;10084;668;False;0;1;13;1;b'Foden on for Mahrez at some point would be good.'
1453451299463311362;1635364768000;Nilsmancity;202;293;False;0;0;0;0;b'Jesus in Mahrez Out'
1453451221734395904;1635364749000;MarkSmi02320603;269;933;False;0;0;1;0;b'Mahrez and Sterling pain to watch \xf0\x9f\x98\xab'
1453451152067072009;1635364733000;SuperStones5;1984;2476;False;0;0;1;1;b'Mahrez and gundo off jesus and foden on'
1453451069904801799;1635364713000;SFC_BOSS;1117;684;False;0;0;2;0;b'Sterling, De bruyne and Mahrez are playing so poorly'
1453450968255848450;1635364689000;KaineOduah;1052;914;False;0;0;1;1;b'Get Mahrez off man he ain\xe2\x80\x99t it today'
1453450819920187398;1635364653000;cityznn;504;167;False;0;0;2;0;b'Mahrez decision making is one of the worst I\xe2\x80\x99ve ever seen'
1453450769567518724;1635364641000;KdbEnthusiasm;1174;1157;False;0;0;0;1;b'@AarxnMCFC Pen shootout, meaning we need to keep ok sterling, gundo, kdb, mahrez'
1453450668845506565;1635364617000;_TJ932O;636;119;False;0;0;12;3;b'There\xe2\x80\x99s too many times atm I feel like mahrez, KDB, gundogan choose the wrong option in the final third.'
1453450531020722184;1635364585000;nduokoli;1160;663;False;0;0;0;0;b'Is Pep sleeping \xf0\x9f\x98\xb4,  Mahrez and Sterling should be off this game \xf0\x9f\x8e\xae.'
1453450509575131139;1635364579000;mikecooke321;303;921;False;0;0;0;0;"b""Mahrez off and let's have a look at Raz back on the right.  Looks lost out on the left .#mcfc"""
1453450440415322122;1635364563000;IowkeyConor;48;44;False;0;0;0;0;b'@Cancelocityv3 Mahrez and Grealish too'
1453450432882294787;1635364561000;05nadjib;68;993;False;0;0;0;0;b'@ManCity @Mahrez22  go unlocked the https://t.co/vH5IOrsyaK have to trust him.'
1453450408798588930;1635364555000;_Yare_Yare_Daze;438;300;False;0;0;3;0;b'@spbajko Mahrez has been terrible'
1453450363483398145;1635364545000;_Yare_Yare_Daze;438;300;False;0;0;1;0;b'This Mahrez stinker...'
1453450277097545734;1635364524000;spbajko;23805;1469;True;6;0;233;7;"b""Mahrez cuts inside and smacks it, only for it to be blocked by De Bruyne. That about sums up City's attacking threat tonight"""
1453450253458460679;1635364518000;CITYBOYFC;141;150;False;1;0;1;1;b'Bro wtf are Kevin and Mahrez doing \xf0\x9f\x98\xad\xf0\x9f\x98\xad\xf0\x9f\x98\x82\xf0\x9f\x98\xad\xf0\x9f\x98\x82\xf0\x9f\x98\xad??'
1453450153579397120;1635364495000;CanceloProp;535;451;False;0;0;1;0;b'Why the fuck is Mahrez standing there with the ball for 10 seconds during a potential counter attack?'
1453450009974878214;1635364460000;Murd73;1278;441;False;0;0;0;0;b'As we don\xe2\x80\x99t tend to win games from 1-0 down, I\xe2\x80\x99d rather Pep make the changes now rather than on 65 minutes. Foden for Palmer. Jesus for either Sterling or Mahrez. Maybe Rodri for Fernandinho'
1453449815522779137;1635364414000;pablophilcaso;124;300;False;0;0;0;0;b'Mahrez is playing like shit, so lazy on the ball sometimes'
1453449537184583688;1635364348000;Snagurk2;243;302;False;0;0;1;0;b'Mahrez is to slow on the ball, get foden on please'
1453449500698288131;1635364339000;gunsbugsnpower;1546;2969;False;0;0;0;0;b'Pep should take off Mahrez'
1453449319617646598;1635364296000;_sir_quinton;2178;1595;False;0;0;0;1;b'@ThandiMCFC @GeraldKoena You are. Mahrez has been better and Gundo.'
1453448988955381767;1635364217000;yassine26982;35;135;False;0;0;0;0;"b""@KOBBYANY @grealishJ21 @City_Xtra @ManCity @PepTeam @Carabao_Cup Mahrez isn't really a bench player tbf plus he scored 3 goals in his last 2 games"""
1453448609375137792;1635364126000;Molade87;1294;1277;False;0;0;0;1;b'@Shmart_ Mahrez is just an Eden Hazard with drum stick legs and flat bum \xf0\x9f\x98\x8f'
1453448531830845443;1635364108000;mcfctawfig;871;973;False;0;0;1;0;b'@Mahrez_sznn Facts'
1453448142825955329;1635364015000;yassine26982;35;135;False;0;0;1;0;b'@KOBBYANY @grealishJ21 @City_Xtra @ManCity @PepTeam @Carabao_Cup If u watched the game u can see that mahrez acc took on the fullback but palmer took it from him and he was offside...'
1453448046449156105;1635363992000;mcfcOrtega;555;969;False;1;0;4;0;"b""Raz, Palmer and Fernandinho played well in the 1st half but Mahrez has been giving the ball away way too much,KDB too...\n\nSeems like one of those days where it doesn't really click for us"""
1453447672820641795;1635363903000;JZMorrisEsq;968;1466;False;0;0;1;0;b'Never thought we\xe2\x80\x99d have Sterling, Mahrez and KDB on the pitch and we\xe2\x80\x99d be crying out for a gamechanger, let alone Phil Foden!'
1453447376287436807;1635363832000;mcfcziyad;2153;3401;False;0;0;1;0;b'Ronaldo gets paid more than cancelo, mahrez, Laporte, foden and Jesus put together and I\xe2\x80\x99m suppose to believe we\xe2\x80\x99re ruining football'
1453447347707465731;1635363826000;JimmerF10;318;650;False;0;0;0;1;b'@BilbaoBaresi We have given the ball away a lot in that half, more than we have done in a long time. KDB, Mahrez, and Zinchenko the main culprits. Just seem off it tonight'
1453447145755918338;1635363777000;JanYoUnchained;36;211;False;0;0;1;0;b'@bernardooooV3 @City_Xtra Nah Mahrez has but Sterling has been better'
1453446767031242755;1635363687000;Realngure;10061;9780;False;0;0;1;0;b'We are winning this. No doubts, Mahrez and Raz will score @sterling7'
1453446633115553792;1635363655000;Laziboy_;1104;903;False;0;0;0;1;"b""@MCFCBaller Rodri is all we need to win this game. But I'd take Foden in for Mahrez and switch up the wings so Raheems on the right"""
1453446419767914500;1635363604000;gamingredox7;0;9;False;0;0;0;1;b'@SepComo @ManCity \xf0\x9f\x98\x82\xf0\x9f\x98\x82\xf0\x9f\x98\x82\xf0\x9f\xa4\xa3\xf0\x9f\xa4\xa3\xf0\x9f\xa4\xa3 Mahrez is the best player in the world.'
1453446090955632644;1635363526000;ENOhnstad;340;694;False;0;0;0;0;"b'@FPLProp 4 captain blanks in a row; Ronaldo, Raphina, Mahrez &amp; Havertz. Guess I stick it on Havertz once more \xf0\x9f\x98\x85'"
1453446021862801414;1635363509000;Remysenpaii;1034;2367;False;0;0;0;0;b'West ham are sitting extremely deep had a couple good chances ale fired wide gk claimed a good cross from Mahrez and gundo Palmer had a decent shot hit straight at the keeper though not playing badly typical frustration playing against a team defending their box https://t.co/dg5HnQ7tMd'
1453445962681171969;1635363495000;mak_nono;1598;961;False;0;0;0;0;b'@CentricBlue @Mahrez22 @JustoneManc Granted! \xf0\x9f\x98\x82\xf0\x9f\x98\x82\xf0\x9f\x98\x82'
1453445847090405381;1635363468000;mcfcdenis_;2568;470;False;0;0;1;0;b'Only palmer and Fernandinho played in that half, the rest need a heavy slap on their head. Especially key players like Gundogan mahrez and de Bruyne'
1453445728681041926;1635363440000;Zakyyyyyyyyyyy7;57;234;False;0;0;0;0;"b""Mahrez and KDB connection is the best in the league man we could see this every weekend if Pep wasn't so bald"""
1453445609449480193;1635363411000;Mehdi76717049;15;117;False;0;0;4;0;b'@ManCity Mahrez soo good but Sterling \xf0\x9f\x91\x8e\xf0\x9f\x8f\xbc\xf0\x9f\x91\x8e\xf0\x9f\x8f\xbc\xf0\x9f\x91\x8e\xf0\x9f\x8f\xbc'
1453445601438404611;1635363409000;J_hanwell;240;714;False;0;0;0;1;b'Very generous boost on the Mahrez market @SkyBet \xf0\x9f\xa4\xaa https://t.co/gSU9FXaPe8'
1453445482454425605;1635363381000;ManCity;11274601;50891;True;44;7;790;30;"b""HALF-TIME | All square at the break. \n\nSome great chances by City, the best being just before the whistle as Ake's header went just wide of the post after a Mahrez free-kick.\n\n\xe2\x9a\x92\xef\xb8\x8f 0-0 \xf0\x9f\x94\xb5 https://t.co/31irK2O2AL"""
1453445437696917510;1635363370000;grealishJ21;86;46;False;0;0;0;2;b'@KOBBYANY @yassine26982 @City_Xtra @ManCity @PepTeam @Carabao_Cup The long ball to Sterling. The ball to Palmer etc etc\xe2\x80\xa6 but if you are against Mahrez, u obviously wouldn\xe2\x80\x99t see it \xf0\x9f\xa4\xa6\xe2\x80\x8d\xe2\x99\x82\xef\xb8\x8f'
1453445367949836300;1635363354000;MauriceKilbride;13728;13206;False;0;0;2;2;b'@neilgiller @PaulHouseK @drivemanpaul @JoRyanAC @AntonyBellis @StvAFC @JeremyPalmer7 Correct - he scored a hat trick fro the under 23\xe2\x80\x99s! He\xe2\x80\x99s very highly thought of at City. Did ok first half, but Sterling, Mahrez and KDB all very poor. One goal either way will decide this #WHUMCI'
1453445340200325120;1635363347000;Remysenpaii;1034;2367;False;0;0;1;0;b'Mahrez today  https://t.co/QTn1jnQKFM https://t.co/h88I9GVJSu'
1453445160973520904;1635363304000;Ethan4707;191;122;False;0;0;0;0;"b""so bored\n\nwatching Mahrez ball ain't easy"""
1453445147052716035;1635363301000;WGK90;2504;3543;False;0;0;0;0;"b""On the subject of this strong City side - what are some of these players, like Mahrez/Sterling/Stones/Zinchenko etc accepting a roles sitting on the bench/cup players. They're better than that. And Sterling/Mahrez look half the players they were 2/3 years ago."""
1453445106988617728;1635363291000;Callumburns44;7;27;False;0;0;0;2;b'@City_Xtra Terrible\xe2\x80\xa6 Sterling and Mahrez their usual give 60%\xe2\x80\xa6 Defence looks shaky with Ake in it\xe2\x80\xa6 only Gundo and Cole have made an effort\xe2\x80\xa6'
1453445074944155654;1635363284000;Remysenpaii;1034;2367;False;3;2;17;0;b'Mahrez man too good https://t.co/gRfjg20UTR'
1453444987383910400;1635363263000;SchwartzSaxon;198;354;False;0;0;0;1;"b""If KdB, Walker,Mahrez, Gundogan play, no one is above it. Leaves no room for complacency in the camp.Also ensures youth inclusions dnt take it for granted,u'stand the opportunity&amp;play accordingly. In our pomp Arsene wld sprinkle a young team with experienced guys in fringes of"""
1453444916818944001;1635363246000;mcfcjosh9320;1161;1023;False;0;0;0;1;b'@City_Chief Sterling and Mahrez off'
1453444885873319936;1635363239000;yassine26982;35;135;False;1;0;2;1;"b""@KOBBYANY @City_Xtra @ManCity @PepTeam @Carabao_Cup Mahrez prolly created the most chances so it's kinda embarrassing that ur not watching the game"""
1453444743753523201;1635363205000;KC_UOD;354;717;False;0;0;2;1;"b""45' | \xe2\x9a\x92\xef\xb8\x8f 0-0 \xf0\x9f\x94\xb5\n\nMahrez swings it in but Ake's header just goes wide. Probably the chance of the half.\n\n#COYI #WHUMCI"""
1453444740083486721;1635363204000;WestHamWaycouk;38011;107;False;0;0;19;2;b'HT 0-0 Ake with probably the best chance of the half but he headed wide from Mahrez free kick, hammers defence holding well so far but not much going the other way as Yarmolenko, Lanzini, Masuaku and co are struggling to create anything'
1453444736010838023;1635363203000;mr_aguia;1353;1901;False;0;0;0;0;"b""Ake's header goes just wide from a Mahrez free kick. Didnt miss by a lot but a free header needs to be on target at least. #WHUMCI"""
1453444720131284995;1635363199000;rhysconnor231;119;212;False;0;0;0;0;b'2nd half subs should be Gabby, Phil, Edozie, Dias, Cancelo on and Mahrez, Palmer, Sterling, Ake, Walker off imo'
1453444663881392135;1635363186000;majestic_foden;144;373;False;0;0;3;2;b'@City_Xtra Palmer settling in. Kdb awful. Sterling and Mahrez decent. Gundo has been our best player.'
1453444656331694085;1635363184000;MahrezBurner;104;89;False;0;0;1;0;b'Mahrez is going to put away this game in the 2nd half\xe2\x80\xa6 get ready West Ham\xe2\x80\xa6 we are the kings on the EFL\xe2\x80\xa6 LETS WIN THIS GAME !'
1453444581387907072;1635363166000;grealishJ21;86;46;False;0;0;1;1;b'@KOBBYANY @yassine26982 @City_Xtra @ManCity @PepTeam @Carabao_Cup You really have an agenda against Mahrez hahahaha. He created the most chances'
1453444564442918919;1635363162000;WestHamNow_;4296;1012;False;0;0;0;1;b'44\xe2\x80\x99 | Riyad Mahrez delivers a free-kick to the back post and Nathan Ake is there to meet the ball but heads wide. #WHUMCI #COYI\n\n#WHUFC 0-0 #ManCity'
1453444358527664132;1635363113000;IowkeyConor;48;44;False;0;0;0;5;b'@City_Xtra Mahrez and Grealish out imo'
1453444245382172680;1635363086000;KOBBYANY;49;75;False;0;0;3;2;b'@yassine26982 @City_Xtra @ManCity @PepTeam @Carabao_Cup Mahrez has been the worse and he\xe2\x80\x99s supposed to be a senior player. Stop talking about the young players'
1453444181444202499;1635363071000;yourboytsheps;26;32;False;0;0;0;0;"b""@MirthCity it's actually mad Gundo Mahrez Zinny and Stones were untouchable last season"""
