id;time;username;follower_count;friend_count;user_verified;retweet_count;quote_count;like_count;reply_count;content
1456835571142180866;1636171641000;OffCutter75;287;1098;False;0;0;8;0;b'@Latheal @Lyanco The only other defenders I\xe2\x80\x99ve seen recently who enjoy and celebrate after a successful defensive move are Rudiger, Bonucci and Chiellini. @Lyanco is in good company \xf0\x9f\x91\x80'
1456798409856331782;1636162781000;as_per__;574;489;False;0;0;1;0;b'@hetros2022 @eko_daddy @chime_szn lmao, he say na chiellini'
1456786060294467597;1636159837000;FredrikReinholt;775;205;False;0;0;0;0;b'@quallieFIFA Chiellini GOATED. \xf0\x9f\x98\x9a jk, i dont really know myself, just switch early and start the run to counter the through-balls asap lul'
1456783476980690944;1636159221000;msn0910;34;216;False;0;0;0;1;b'@bigby4life 8.58 inches not too bad Chiellini would be proud.'
1456778029271748612;1636157922000;DonBale_;112;78;False;0;0;0;1;"b""injury prone, and were not Serie A quality. I still don't understand why Sarri didn't play Mandzukic. Higuain was washed after getting depression. Alex Sando and de Sciglio were our LB as well and both of them are shit. Chiellini injured all season... to be continued (6/14)"""
1456774415686021127;1636157060000;r0h41l_13;486;689;False;0;0;0;2;"b""@uzayrr__ @ReformdDrg0nite I never claimed to watch them, but he got voted defender of the year, that's enough for me to know he is good seeing as he gets that ahead of De ligt, de vrij, skriniar, bonnuci, chiellini ect. U base our players off their worst games for some odd reason."""
