id;time;username;follower_count;friend_count;user_verified;retweet_count;quote_count;like_count;reply_count;content
1457745886046396419;1636388677000;AmbrozRitz;1228;1565;False;2;0;58;4;"b""@johny_arsenal @ChrisWheatley_ Man's a physical beast. I fucking dare Lukaku to get past him."""
1457744732201783296;1636388402000;kal991311;65;690;False;0;0;1;0;b'@REDNECKBLUE1905 @kendallrowanx @LadimusPrime Salah KDB, lukaku, hazard and a lot more were found under his reign'
1457744114821341186;1636388255000;ChelseaNewsApp;691;280;False;0;0;0;0;b'Newcastle move for transfer guru who discovered De Bruyne and Lukaku after Overmars snub: https://t.co/vLo9nztKEY'
1457743738705522691;1636388165000;OfficialPhilipN;252;426;False;1;0;3;1;b'@csfraw @Ghanasoccernet Ah bro appreciate something wai,Lukaku is all time Belgium \xf0\x9f\x87\xa7\xf0\x9f\x87\xaa top scorer buh has still not won anything for the national team and he can never be excluded from the their all time dream team'
1457743391521853441;1636388082000;MarcusUTD_;3223;1052;False;0;1;8;2;b'How ironic would it be if it was Josh King and then Lukaku who got Ole sacked'
1457743187913682950;1636388034000;JustJosh132;740;677;False;0;5;2;5;b'I dunna about attraction but good looking??? Yip:\n\n-Solofelang \xf0\x9f\x98\x8d\xf0\x9f\x98\xad\n-Hector Bellerin \n-Jack Grealish \n-Loftus Cheek\n-Giroud \n-Neymar (sometimes)\n-Sergio Ramos \n-Andre Gomes \n-Kevin Prince Boateng \n-Lukaku with the right haircut and on the pitch (man can\xe2\x80\x99t dress) \n-Morata\n-Benzema https://t.co/xefo9v8zap'
1457743081961369615;1636388008000;justbadvibes2;27;103;False;0;0;0;1;b'why do ppl even care. Those that do run their own social media (lukaku) gets mocked because of the way he speaks \xf0\x9f\xa4\xa6\xf0\x9f\x8f\xbe\xe2\x80\x8d\xe2\x99\x80\xef\xb8\x8f I\xe2\x80\x99m sorry but if I was an athlete I would be on here with you lot on social media either cause some of the stuff said abt them is just vile.'
1457742599310217220;1636387893000;CFC_Sam12;73;388;False;0;0;1;1;b'@ftblHj Do you think he could work with Lukaku?'
1457741298845339656;1636387583000;thechelskikid;257;439;False;0;0;0;0;"b""@abzo2x @Carefree_Dave @ConnCFC @John2606Terry @IestynHarries @_DeclanRice I don't get your point. I have no idea if the board will sanction it. Neither do you. Tuchel doesn't negotiate the deals. You know that. If we had wanted Lukaku in 17 we would have got him. All I have said is I would like Rice at the club. Why does that trigger you?"""
1457740844274946049;1636387475000;Moise_keanLW;6;108;False;0;0;1;1;b'@auliaaoi @madEka_A303 @juvefcdotcom @tuttosport Yea but de ligt also pocet Lukaku its mean that he is bad or overated?'
1457740031544676356;1636387281000;kaihugh24873290;3;24;False;0;0;0;0;b'@ZinoMuno5 @MyNamesDannyyy @AAsmoke @AbsoluteChelsea No you can\xe2\x80\x99t compare them cause 1 had a full career to prove himself and the other still has 5 odd years to prove himself ability wise lukaku is more than capable of matching Drogba if not surpassing him but that\xe2\x80\x99s a massive IF'
1457739754917748736;1636387215000;aymlangford;403;397;False;0;0;1;1;"b""@IbzSpeaks Having Hazard, KDB, Lukaku and Salah playing together would have created a team so fearful we'll dominate Europe. It's why today I'll prioritize long term growth over instant success of there are signs. Luckily Tuchel is doing a both"""
1457739735259041798;1636387211000;evilbluebird;25419;9173;False;0;0;3;0;b'Newcastle move for transfer guru who discovered De Bruyne and Lukaku after Overmars snub https://t.co/O491lXGU44 via @NewsNowUK'
1457738250425151491;1636386857000;KaveGhana;48;32;False;0;0;1;0;b'Lukaku has more goals than Harry Kane this season? \xf0\x9f\xa4\x94\n\nAbena Korkor\nOleout\nMan united\nRonaldo'
1457737836350738435;1636386758000;CFCCentral3;8966;508;False;0;0;11;1;"b""@kendallrowanx that they were the future. He also vouched for a 17-year-old Lukaku from Anderlecht and an 18-year-old KdB from Genk, as well as Hazard. He's a strong organizer, has excellent contacts in the game and is a rare executive in the sense that he watches the game closely and makes"""
1457737665730674691;1636386717000;IbzSpeaks;1680;758;False;0;0;23;3;b'Michael Emenalo was criminally disrespected by a lot of Chelsea fans. \n\nHe\xe2\x80\x99s the one that discovered KDB, Thibaut Courtois, Romelu Lukaku and Mohamed Salah. He discovered so many gems and got hammered for discovering Michael Hector \xf0\x9f\x98\xa4 https://t.co/UzudgIdLLn'
1457737166914732036;1636386598000;thechelskikid;257;439;False;0;0;0;0;"b""@abzo2x @Carefree_Dave @ConnCFC @John2606Terry @IestynHarries @_DeclanRice Just because I rate another player and would like him at my club doesn't mean I have to support them does it? Don't you rate other players? I rate Chiesa and Raphinia. Do I have to support Leeds and Juve now? The board said the same about Lukaku. Look what happened."""
1457737069032321025;1636386575000;SamTheMan_CFC;692;328;False;0;0;1;0;b'The fact he was the guy he found talents like KDB, Salah and Lukaku says it all really. Man has a knack for good talent. https://t.co/7MpYGWRZ9U'
1457736979945345026;1636386554000;miasanbest;127;281;False;0;0;0;0;b'@CFC_Kevin_ @ChampionsLeague Lukaku finished his career 10 games earlier so he isnt the one for goals nowadays'
1457736226312753158;1636386374000;ChelseaRooter;16995;301;False;0;0;0;0;b'Newcastle move for transfer guru who discovered De Bruyne and Lukaku after Overmars snub\n#CFC #KTBFFH\nhttps://t.co/OAbRjcc4o4'
1457736165747011587;1636386359000;DExpress_Sport;57100;440;True;0;0;6;0;b'Newcastle move for transfer guru who discovered De Bruyne and Lukaku after Overmars snub https://t.co/zbXBf972ya'
1457736069491925005;1636386337000;TheFamousCFC_V1;2618;925;False;0;0;3;1;"b""And KDB, Salah, Courtois and Lukaku. Had the board backed him and not got Mourinho, we'd have turned the PL into the Bundesliga by now. https://t.co/hIsybIde8u"""
1457735940529610752;1636386306000;_TAHA1_;53;285;False;0;0;0;1;b'@CfcLex That man got Lukaku hazard courtois and KDB wdym'
1457735852956737541;1636386285000;DraftAnswers;2700;4869;False;1;0;2;1;b'Who would you rather own rest of season?\n\nAntonio / Lukaku / Calvert-Lewin / Jiminez\n\nVote now \xf0\x9f\x97\xb3\xef\xb8\x8f\n#HelpMyFantraxDraft'
1457735592872013825;1636386223000;ZinoMuno5;45;396;False;0;0;0;1;"b""@kaihugh24873290 @MyNamesDannyyy @AAsmoke @AbsoluteChelsea To be honest these Chelsea players aren't really that good even it comes to quality. You can't compare Lukaku to Drogba, you can't compare Mount to Lampard and you can't yet compare Rudiger to JT but I believe the manager has found a way to make them play good as a team"""
1457734810974162957;1636386036000;L4fckop;702;403;False;0;0;0;1;b'@Fahim_LDN @RobinK1983 @SimonBrundish Both have as many goals as \xc2\xa397m Lukaku, more goals than \xc2\xa3100m Grealish and \xc2\xa375m Sancho but because you don\xe2\x80\x99t rate them their goals don\xe2\x80\x99t count right? \xe2\x80\x9cBobby out for 2 months\xe2\x80\x9d ok? Divock came in yesterday and fucking scored IN THE PREMIER LEAGUE. Wtf you want from these players?'
1457734697845288962;1636386010000;shamilrasheed8;309;658;False;0;0;0;1;b'@Hard_Studs @LeslieRcdson @CFCPys @Matt_Law_DT Piet de visser was the reason, we signed KDB, Lukaku etc.....'
1457734165214998534;1636385883000;varmoooo;43;159;False;0;0;0;1;b'@J4FN1_ No worries, we are slowly stabilized, the team is more balanced . If Lautaro Dzeko can work up their chemistry more we wouldnt have any worries, but currently its so much behind of Lukaku- Lautaro duo.'
1457733427772469252;1636385707000;only1munashe;414;382;False;0;0;7;0;b'@kendallrowanx @kingkaifc Basically convinced Roman to invest in the Chelsea academy also has a good eye for talent signed Lukaku, Salah, De Bruyne and Hazard as Under 21s'
1457733396969492487;1636385699000;NgwaneTdn;558;569;False;0;0;1;0;"b'@BrianGDK_ Really wanna see Callum Left, Mount Right and Lukaku uptop. I hope its our best.\nCrazy we can even try Kai &amp; R9 uptop with CHO in behind, or CHO &amp; Pulisic on the flanks with R9.\nCHO must play in summary.'"
1457733124721463304;1636385634000;slendztalks;1388;411;False;1;0;12;1;b'Very mixed CV. Responsible for the Belgian talent who broke through at Chelsea: Lukaku, KDB, Eden, Courtois but simultaneously, overseen some questionable transfers. https://t.co/Kki36nUi7u'
1457732683346370567;1636385529000;Blueholic007;35;147;False;0;0;0;0;b'@siphillipssport @_GIFN He should expand his wish list and include Lukaku, reece, Mendy and Tuchel as his assistance.'
1457732613989412870;1636385513000;jr1of1;242;100;False;0;0;2;1;b'Black man never got his credit for creating the Hazard KDB Lukaku and Salah super team before Jose ruined it https://t.co/ROzZozSi5A'
1457732297004929024;1636385437000;audreysprayer;13;89;False;0;0;0;0;"b'@pras_fpl Are you Kane &gt; Lukaku? I can afford either as Vardy is going'"
1457731813409837059;1636385322000;cfc_pravesh19;114;229;False;0;0;0;0;b'@CarefreeTactics How to get the best out of lukaku in our current setup'
1457731668173750274;1636385287000;LolBuoy;450;567;False;1;0;17;0;"b""@kendallrowanx Exceptional eye for talent! KDB Lukaku Tibo Salah Christensen were all his identification. If he's your DoF, it's an upgrade on Overmars"""
1457731103398273031;1636385153000;Slitz1k;202;221;False;0;0;0;1;"b""@ftblstad @ftblseb Just because his top 5 don't make him an elite passer \xf0\x9f\xa4\xa3\xf0\x9f\xa4\xa3\xf0\x9f\xa4\xa3\xf0\x9f\xa4\xa3. Kova, kai, kante,pulisic, chilwell, lukaku and barkley don't make that pass. None of our players are elite passers"""
1457730177874726914;1636384932000;syprin2006;5;258;False;0;0;2;1;b'@CarefreeTactics The use of Lukaku in the future, will he be a target man or can we play him in a better way to suit him'
1457728824515366914;1636384609000;ryan_razzak;219;497;False;0;0;0;0;b'@flameosumeet No man you\xe2\x80\x99re completely wrong. It was de visser who brought hazard, lukaku and kdb'
1457727415032102923;1636384273000;HinduMonkey;14667;902;False;0;0;1;0;"b""@ShivaFPL I'd rather have Lukaku if he's back, Jesus or Ronaldo depending on int break/ole situation\n\nbut it's your team mate, if you want to spend 22.5m on the most anemic attack in the league I can't stop you"""
1457726846997573634;1636384138000;opargoo;1792;680;False;0;0;0;0;"b""@AdamAlfi @MrTomMcDermott How's Lukaku doin"""
1457725566329753600;1636383832000;CR7sLegacy;421;165;False;0;0;3;0;b'The winner should be Thomas M\xc3\xbcller, the man with 27 club assists in 2021.\n\nBut instead they will give it to a guy with as many club assists as Lukaku, Saka and Michail Antonio because he has better PR. https://t.co/jlen5bBwVa'
1457725426822955020;1636383799000;The_BeatOven;1986;1654;False;1;0;1;1;b'Mane and lukaku after playing 90mins https://t.co/B6Ze9WNdFL'
1457724983388561411;1636383693000;flameosumeet;3293;521;False;0;0;38;5;b'He was basically the guy that brought in Hazard KDB Lukaku and Salah, Newcastle are set https://t.co/rAUIGMz8jF'
1457724702793863172;1636383627000;pokerpapi81;19;163;False;0;0;0;1;b'@26daysofpain @GrandePippo_09 @IFTVofficial I guess calling your best player dollarumma for 4+ years isn\xe2\x80\x99t emotional \xf0\x9f\x98\x82.\n\nThe only emotion I had with Lukaku was pure joy at winning the scudetto \xf0\x9f\xa4\xab'
1457724291189968897;1636383528000;dejimascot;123;84;False;0;0;0;0;b'This is the best International break any #chelseafc fan could pray for lukaku, kovacic, Timo, Mount are not fit and we need them in our next matches. https://t.co/HKgugQCR5m'
1457724214757236747;1636383510000;BrianGDK_;13433;186;False;0;0;7;1;b'Against Leicester, granted everyone is fit, I want to see a Callum - Lukaku - Mount front 3.'
1457724213490589701;1636383510000;BrianGDK_;13433;186;False;1;0;11;2;"b""In these 6 games, he has been directly involed in a goal every 107 minutes.\n\nIf anyone of the players who has played in Lukaku, Werner and Mason's absence has staked their claim for a further starting spot, it's Callum."""
1457724070238179329;1636383476000;cfc_pxrth;179;461;False;0;0;2;0;"b""@classycarvalho His assist vs arsenal to Reece wasn't cross and his assist vs Norwich to Reece was through ball, these two are clearly non crossing big chances.\n\nKai's big chance miss against arsenal was cross, Lukaku's missed chance vs south. Was cross.\n\nLukaku's header vs ars was debatable."""
1457723297311993857;1636383291000;EFC6EFC6;433;1480;False;0;0;1;1;b'@TheWillRoss @MarkOldacres @AVFCFaithful_ That first year with him was so fun but as soon as Moyes back 4 started to decline he had no idea what to do. A shambles, to finish 11th twice with Lukaku, Baines, Coleman, Stones, Barkley, Deulofeu etc was crazy underperforming'
1457722641943601154;1636383135000;pgr_analytics;6926;491;True;4;0;60;7;b'\xf0\x9f\x94\xb4 \xf0\x9d\x97\xa5\xf0\x9d\x97\xa2\xf0\x9d\x97\x95\xf0\x9d\x97\x98\xf0\x9d\x97\xa5\xf0\x9d\x97\xa7\xf0\x9d\x97\xa2 \xf0\x9d\x97\xa0\xf0\x9d\x97\x94\xf0\x9d\x97\xa5\xf0\x9d\x97\xa7\xf0\x9d\x97\x9c\xf0\x9d\x97\xa1\xf0\x9d\x97\x98\xf0\x9d\x97\xad \xf0\x9f\x94\xb4\n\n- Fluid 5-3-2 into a 3-4-3 \n- Possession based - focussed on ball retention\n- KDB/Lukaku publicly criticised for not being attacking enough\n- 44% Win rate\n\nIssue: Everton fans stated poor game management and struggles defensively \n\n#AVFC https://t.co/A0R9hMEiL1'
1457722118259417099;1636383010000;PrinceA51800613;79;280;False;0;0;2;2;b'@siilvacfc @RomeluLukaku9 Yeah agree with that some are good, \n\nI\xe2\x80\x99m sure Lukaku listens to stomrzy'
1457721128814878723;1636382774000;CFCSmit;53;175;False;0;0;0;0;"b""Thought Dzeko could do the exact same Lukaku did according to Inter? Wonder why they're 7 points behind first place then."""
1457720538063908867;1636382634000;JakeSH03;485;927;False;0;0;6;0;b'@LCFCshitposting Pocketed Ronaldo tbf Lukaku is light work for him'
1457720021065641996;1636382510000;HandsomeJaxTHFC;745;1367;False;0;0;1;1;"b""@smileberg @LilyW_S2_ @J_Mwanzo Ndombele to create and Kane and Son up front.  I would be very surprised if this isn't the system that Conte plays as it will mirror what he did with Inter having Lukaku/Lautaro Martinez up front, just in our case Kane/Son."""
1457719980099837953;1636382501000;CfcMount4;674;583;False;0;0;30;3;"b""@TeacherOfBall @RomeluLukaku9 Lukaku is something your club doesn't have a striker get a striker first then chat to us"""
1457719603040333826;1636382411000;tdubinyoface;550;1497;False;0;0;2;1;b'Lukaku scored 12 goals in 22 starts for United and was \xe2\x80\x9cfat and finished\xe2\x80\x9d but at Chelsea 3 goals in 7 starts and he\xe2\x80\x99s apparently the best striker itw'
1457718892600627203;1636382241000;OscurosFPL;147;201;False;0;0;2;1;b'@FPLCrateDigger I have Kane and keeping him, only bought because Lukaku got injured. In no rush to sell, but not a buy if I didn\xe2\x80\x99t have him. Gives me simple option to Ronaldo in GW16 also so not too concerned right now.'
1457717537010065415;1636381918000;TheCosmos5;495;512;False;0;0;6;1;"b""@MattyDryden @NipseyCFC @st_prm @OFunnell @TeleFootball @Matt_Law_DT KDB, Lukaku and many others. Chelsea's loan system is his idea"""
1457717276073988098;1636381856000;honest_sancho;628;623;False;0;0;0;0;b'@pwefc1 We, Chelsea FC, are very well capable of winning every trophy in the book with the squad we have. But until Tuchel isn\xe2\x80\x99t sacked all we\xe2\x80\x99re winning is a goal every 2 months from lukaku.'
1457716863572533248;1636381758000;honest_sancho;628;623;False;0;0;2;0;b'@ezrandez We, Chelsea FC, are very well capable of winning every trophy in the book with the squad we have. But until Tuchel isn\xe2\x80\x99t sacked all we\xe2\x80\x99re winning is a goal every 2 months from lukaku.'
1457716769091641349;1636381735000;LumenPaul2;355;315;False;0;0;0;1;"b""@maduekwejr @ola_bodee @Blue_Footy But guy you know Lukaku hasn't seen enough chances sha\nWe play matches that they even count the number of times he got on the ball\nNo one is getting the ball to him in the right areas"""
1457716629505286145;1636381702000;honest_sancho;628;623;False;0;0;3;0;b'@FabrizioRomano We, Chelsea FC, are very well capable of winning every trophy in the book with the squad we have. But until Tuchel isn\xe2\x80\x99t sacked all we\xe2\x80\x99re winning is a goal every 2 months from lukaku.'
1457716592595320835;1636381693000;bjfikky;945;1001;False;0;0;1;2;b'@Abdu1Mo @JAC_FT1 @FlexUTD You need help if you think a manager needs 11 new players to win. Tuchel won the UCL with no signing, top of the table with Lukaku (the one signing) barely playing. Your Lord and savior Ole isn\xe2\x80\x99t even playing his marquee signing.'
1457716413418950656;1636381650000;honest_sancho;628;623;False;0;0;1;2;b'@cfcfreddie2 We, Chelsea FC, are very well capable of winning every trophy in the book with the squad we have. But until Tuchel isn\xe2\x80\x99t sacked all we\xe2\x80\x99re winning is a goal every 2 months from lukaku.'
1457716362491703302;1636381638000;FutbolElio;346;205;False;0;0;2;0;b'@TheRealJamDog That\xe2\x80\x99s on Lukaku for being overweight'
1457715981846032387;1636381547000;TheRealJamDog;1375;399;False;0;0;1;1;b'@Elio_v06 No open play goal since September and has played more than Lukaku since then'
1457715106666532871;1636381339000;bengz_ya;54;458;False;0;0;0;1;"b""@RiddlezF @BenWorthy8 @SeanDOlfc Yeah could've said the same for lukaku \xf0\x9f\xa4\xb7"""
1457715059229184002;1636381327000;ryan_razzak;219;497;False;0;0;1;0;b'Don\xe2\x80\x99t know why everyone is saying that this is phenomenal? He failed at Monaco and De visser was responsible for hazard, lukaku and de bruyne so he was lucky at Chelsea https://t.co/C2N25WPExv'
1457714399293083652;1636381170000;dennisclaude89;258;195;False;0;0;8;3;"b""@dodgerspl @Matt_Law_DT It's only Djilobodji you can pick from the lot? Not Hazard, mata,kdb, lukaku, salah the list is long. We are also enjoying the fruits of the good work he did transforming our academy"""
1457714371304509441;1636381163000;CFCvioo_;160;167;False;0;0;1;1;b'@LiberoNUFC He found salah lukaku hazard and de bruyne mate\xf0\x9f\x98\x82 his talent spotting is an absolute joke'
1457714348227395593;1636381158000;cfc_pxrth;179;461;False;0;0;2;2;"b""@classycarvalho He can play when Lukaku and havertz aren't playing, his ball receiving stats are better than our whole attack.\n\nWe cannot play him there because we have to accomodate our two big money signings lukaku and havertz in this system.\n\nLukaku on wing will be pressing liability on wing."""
1457714219244261389;1636381127000;Carr18Alex;230;815;False;0;0;3;1;"b""If you're not sure who Michael emenalo is...some names he has discovered:\n\nEden hazard\nSchurrle\nSalah\nDe bruyne\nLukaku\nWillian\nBa\nEto'o\n\nIf this is true, big things for #NUFC"""
1457713915098447881;1636381055000;ChelseaNewsApp;691;280;False;0;0;0;0;b'What Chelsea forward Kai Havertz has worked on to help Blues cope with Romelu Lukaku injury: https://t.co/I2PUqUjBL2'
1457713914989383680;1636381055000;ChelseaNewsApp;691;280;False;0;0;0;0;"b""Kai Havertz' improved heading ability has helped in the absence of Romelu Lukaku: https://t.co/m5jPNgryn5"""
1457713906437271556;1636381052000;_kejvin;69;501;False;1;0;8;1;b'@XonZone Me when Lukaku left Inter https://t.co/wu9eGsAZO9'
1457713648986644480;1636380991000;BoldArchie_;8179;8225;False;0;0;1;0;b'This man got us Hazard, De Bruyne, Lukaku, Oscar, Courtois when they were all under 21 years. Add in Ramires, Salah, Moses etc. He added aome seriously talented young players after the 2012 UCL win. Newcastle will be very lucky https://t.co/qclXEl1Viv'
1457713073222004738;1636380854000;TyneTheory;291;185;False;0;0;3;0;"b""I'd be more than happy with this. He signed Salah, Kante, De Bruyne, Fabregas, Lukaku, Hazard. Basically many of the greatest players in prem history... https://t.co/mQQK0KjunE"""
1457712999884591104;1636380836000;Gijs_030;185;564;False;0;0;1;1;b'@connect_nate I think the real question is the double up. Personally I think Trent and Cancelo remain essential for my team, but I\xe2\x80\x99m eyeing Chilly for a 4atb set up. Both have been magnificent, though I do favour James long term when Lukaku gets back'
1457712913721004036;1636380816000;olufemiAghe;1360;246;False;0;0;0;1;b'@depay_1 Mou was never title contender, that\xe2\x80\x99s why he called that his biggest achievement\xe2\x80\xa6 also kindly watch football more because Mou packing the bus and De Gea in his prime was the only reason he finished 2nd, so why mention grant? In his 3rd season he signed Ibrahimovic and lukaku 1/2'
1457712899758166016;1636380812000;TyneTheory;291;185;False;1;0;9;1;b'@Chadwick_10 @TeleFootball @Matt_Law_DT He is behind the signings of Salah, De Bruyne, Kante, Fabregas, Hazard, Lukaku, Tielemans, Rudiger, Azpilicueta. Would be an amazing move.'
1457712807651250176;1636380790000;greenaway03;74;374;False;0;0;0;1;b'@FPL_DaddyIngs @CFCPz_ @hasan80362133 @Tgarratt10 Ronaldo literally outscored lukaku with a worse team and worse manager than lukaku'
1457712386757087235;1636380690000;Seabelo_Lekoko;6422;2874;False;0;0;11;1;b'@AbsoluteChelsea @TeleFootball That\xe2\x80\x99s one appointment that will work wonders for them. The man who brought us Salah, Lukaku, Oscar, Hazard, KDB etc'
1457712170293137410;1636380639000;LahmFi;349;471;False;0;0;0;0;b'@PaulieNapoli89 @wee_rogue Positions to have a shot is covered in Chances Created, of which Chelsea only created 2.\n\nOffsides don\xe2\x80\x99t show in stats because the chance wouldn\xe2\x80\x99t exist if they were onside. \n\nAlso Mbeumo hit the post directly before Lukaku\xe2\x80\x99s offside goal at 0-0. Brentford should have been ahead.'
1457712154157670400;1636380635000;OKomuhendo;1480;1211;False;0;0;7;1;b'@K_Stanley28 @AidenKaliisa @sasmvn @PatriqKanyomozi @Allano56 Lukaku and Hazard wherever you are Enanga is looking \xf0\x9f\x91\x80 for you https://t.co/ZeSSoKdlle'
1457711927145246723;1636380581000;NUFC_HQ;10476;233;False;2;1;20;1;b'Emenalo brought the likes of Cesar Azpilicueta, Antonio Rudiger, N\xe2\x80\x99Golo Kante and Marcos Alonso to Chelsea who all remain key players to this day.\n\nEden Hazard, Romelu Lukaku, Cesc Fabregas, Kevin De Bruyne and Mohamed Salah are amongst others he signed for Chelsea.\n\n#NUFC'
1457711543416770563;1636380489000;Kevin56571268;0;13;False;0;0;3;2;"b""@cfchziyech @FabrizioRomano Lukaku is a flop..Vardy isn't consistent let's not talk about the other players in book\xf0\x9f\x9a\xae\xf0\x9f\x9a\xae"""
1457710486133280777;1636380237000;SixsmithTV;4343;941;False;0;0;4;1;b'This would be a sensational appointment for #NUFC if it comes off - Emenalo brought the likes of Kant\xc3\xa9, Azpilicueta, De Bruyne and Lukaku to Chelsea and has a serious track record in identifying top talent and working with big budgets. https://t.co/S4XGnEKkx4'
1457710478965321734;1636380235000;cfc_vri;76;269;False;0;0;0;0;b'@HowaynShite He brought Kante, DeBryne, Lukaku, Hazard and Salah to Chelsea though'
1457710382282326020;1636380212000;LumenPaul2;355;315;False;0;0;0;2;b'@ola_bodee @maduekwejr @Blue_Footy Forget we miss chances oh\nBut we still have a fair number of goals scorers\nLukaku, werner, Mount, Pulisic, Havertz, Reece, Chilwell, Alonso, RLC \nThey just need to improve and be more clinical.\nBut which of our players can you depend on for double digits assists in a season?'
1457710364490182669;1636380208000;kudaaa09;38;81;False;0;0;0;0;"b'Newcastle is on the right path. Look at how many quality chelsea academy players coming up now. It\xe2\x80\x99s all him. He also got us KDB, Salah, Lukaku &amp; hazard https://t.co/UtCkI07zFC'"
1457709538665287687;1636380011000;FPLDisasterClas;108;244;False;0;0;0;2;"b""I'm obviously going to wait for the end of the international break. But for my next #FPL move I'm thinking about bringing taking out Vardy for Lukaku (if he's fit). The only issue is, I need an extra 0.1m to make this happen.\n\nSo where does the extra transfer come from? https://t.co/2J9nR8X8RZ"""
1457709029346603012;1636379890000;aydenashraff_;42;91;False;0;0;0;1;"b""@Peterhlxgi @Blue_Footy What? We create so many chances when we play with havertz up front but it's weird , we can't create a chance with Lukaku upfront lol"""
1457708492110827522;1636379762000;inthezoneuk;412;415;False;0;0;0;2;"b""@talkSPORT @Sjopinion10 Ironically, United were winning against top teams last season &amp; losing to the smaller ones. In that sense, Ronaldo is perfect. However, one man doesn't make a team. Ask Messi at PSG! Ronaldo scored 101 goals in 134 games in Serie A &amp; scored more than Lukaku last season."""
1457708308110979075;1636379718000;wkndbassist;173;453;False;0;0;0;0;b'I cannot wait for Lukaku and Timo to be back man https://t.co/P5ItTjVDlk'
1457708148500873220;1636379680000;24hrsReport;8490;4137;False;0;0;0;0;b'What Chelsea forward Kai Havertz has worked on to help Blues cope with Romelu Lukaku\xc2\xa0injury https://t.co/QjwPStQXiz'
1457707522119413763;1636379530000;PaulieNapoli89;2;51;False;0;0;0;0;"b'@LahmFi @wee_rogue Lukaku was unlucky with offside. Doesn\xe2\x80\x99t show that on the stats does it fella? Wee man Rogue needs to stop inhaling that anti chelsea narrative. That Burnley game was fuck all like any of them others &amp; CFC should\xe2\x80\x99ve been 2 up against Brentford I don\xe2\x80\x99t care what anyone says \xf0\x9f\xa4\xb7\xf0\x9f\x8f\xbb\xe2\x80\x8d\xe2\x99\x82\xef\xb8\x8f'"
1457707419367354368;1636379506000;afcamir11;254;1585;False;0;0;1;0;b'@LeeFussBall Rudiger is German \nLukaku is Belgian \nBarley and CHO are English \nKante is French'
1457706759166959626;1636379348000;Abhishe53211473;421;3534;False;0;0;0;0;b'So this is what Lukaku was preparing for during his injury lay off\xf0\x9f\x98\x82 https://t.co/egFGdrWenN'
